{
  "schemaVersion": 3,
  "configId": "config_pinned_diagnostic",
  "model": "openai/gpt-oss-120b",
  "fallbackModels": [],
  "providerRouting": {
    "order": ["baseten/fp4"],
    "pinToOrder": true,
    "zeroDataRetention": true,
    "denyDataCollection": true,
    "maxPrice": {
      "prompt": 0.5,
      "completion": 1.5,
      "request": 0
    }
  },
  "budgets": {
    "maxInitialEvidenceBytes": 32000,
    "maxConversationBytes": 128000,
    "maxOutputTokensPerCall": 16384,
    "maxTotalTokens": 240000,
    "maxTotalCostUsd": 0.2,
    "timeoutMs": 180000,
    "maxAttemptsPerCall": 2,
    "minimumCallIntervalMs": 1500
  }
}
