{
  "schemaVersion": 3,
  "configId": "config_budget_120b",
  "model": "openai/gpt-oss-120b",
  "fallbackModels": ["z-ai/glm-5.3-flash", "deepseek/deepseek-v4-flash-0731"],
  "providerRouting": {
    "order": ["coreweave/fp4", "deepinfra/bf16"],
    "maxPrice": {
      "prompt": 0.1,
      "completion": 0.8,
      "request": 0
    }
  },
  "budgets": {
    "maxInitialEvidenceBytes": 350000,
    "maxConversationBytes": 600000,
    "maxOutputTokensPerCall": 8192,
    "maxTotalTokens": 1400000,
    "maxTotalCostUsd": 0.25,
    "timeoutMs": 240000,
    "maxAttemptsPerCall": 3,
    "minimumCallIntervalMs": 1500
  }
}
